{
  "format": "asakiri-course",
  "formatVersion": 1,
  "id": "exercise_cat_fill_blank",
  "type": "fill-blank",
  "instruction": "Drop the right word into the blank.",
  "prompt": [
    {
      "id": "prompt_fill_intro",
      "role": "primary",
      "binding": {
        "kind": "literal",
        "value": {
          "type": "text",
          "text": "This is a cat."
        }
      }
    }
  ],
  "stem": [
    {
      "kind": "text",
      "fragment": {
        "id": "stem_kore_wa",
        "role": "primary",
        "binding": {
          "kind": "literal",
          "value": {
            "type": "text",
            "text": "これは"
          }
        }
      }
    },
    {
      "kind": "blank",
      "id": "blank_animal"
    },
    {
      "kind": "text",
      "fragment": {
        "id": "stem_desu",
        "role": "primary",
        "binding": {
          "kind": "literal",
          "value": {
            "type": "text",
            "text": "です。"
          }
        }
      }
    }
  ],
  "translation": {
    "id": "fill_translation",
    "role": "translation",
    "binding": {
      "kind": "literal",
      "value": {
        "type": "text",
        "text": "This is a cat."
      }
    }
  },
  "bank": [
    {
      "id": "bank_neko",
      "body": [
        {
          "id": "bank_neko_text",
          "role": "primary",
          "binding": {
            "kind": "field",
            "recordId": "record_cat",
            "fieldId": "field_japanese"
          }
        }
      ]
    },
    {
      "id": "bank_inu",
      "body": [
        {
          "id": "bank_inu_text",
          "role": "primary",
          "binding": {
            "kind": "field",
            "recordId": "record_dog",
            "fieldId": "field_japanese"
          }
        }
      ]
    },
    {
      "id": "bank_tori",
      "body": [
        {
          "id": "bank_tori_text",
          "role": "primary",
          "binding": {
            "kind": "field",
            "recordId": "record_bird",
            "fieldId": "field_japanese"
          }
        }
      ]
    }
  ],
  "evaluation": {
    "kind": "filled-blanks",
    "blanks": [
      {
        "blankId": "blank_animal",
        "correctOptionIds": ["bank_neko"]
      }
    ]
  }
}
